{
    "manifestID": "MANI123456",
    "receivingFacilityID": "FAC-ABJ-00123",
    "receivingFacilityName": "General Hospital Maitama",
    "sendingPCRLabID": "LIMS150002",
    "sendingPCRLabName": "National Reference Lab Abuja",
    "testType": 1,
    "viralLoadTestReport": [
      {
        "patientID": [{ "idNumber": "HOSP0001234", "idTypeCode": "HOSPITALNO" }],
        "firstName": "AMINU",
        "surName": "BELLO",
        "sex": "M",
        "dateOfBirth": "1991-03-12",
        "sampleID": "SMP0000001",
        "pcrLabSampleNumber": "PCR-ABJ-240901-001",
        "visitDate": "2025-08-31",
        "dateSampleReceivedAtPCRLab": "2025-09-02",
        "testResult": "3,450 copies/mL",
        "resultDate": "2025-09-03",
        "assayDate": "2025-09-03",
        "approvalDate": "2025-09-03",
        "dateResultDispatched": "2025-09-04",
        "sampleStatus": 3,
        "sampleTestable": true,
        "testedBy": "MLS. K. Yusuf",
        "approvedBy": "Dr. T. Okon"
      },
      {
        "patientID": [{ "idNumber": "REC00056789", "idTypeCode": "RECENCY" }],
        "firstName": "ZAINAB",
        "surName": "USMAN",
        "sex": "F",
        "dateOfBirth": "1997-05-20",
        "sampleID": "SMP0000002",
        "pcrLabSampleNumber": "PCR-ABJ-240901-002",
        "visitDate": "2025-08-31",
        "dateSampleReceivedAtPCRLab": "2025-09-02",
        "testResult": "<20 copies/mL (Target Not Detected)",
        "resultDate": "2025-09-03",
        "assayDate": "2025-09-03",
        "approvalDate": "2025-09-03",
        "dateResultDispatched": "2025-09-04",
        "sampleStatus": 3,
        "sampleTestable": true,
        "testedBy": "MLS. E. Nwosu",
        "approvedBy": "Dr. I. Gabriel"
      },
      {
        "patientID": [{ "idNumber": "CLI00033456", "idTypeCode": "CLIENTID" }],
        "firstName": "IBRAHIM",
        "surName": "ALI",
        "sex": "M",
        "dateOfBirth": "1984-07-04",
        "sampleID": "SMP0000003",
        "pcrLabSampleNumber": "PCR-ABJ-240901-003",
        "visitDate": "2025-08-31",
        "dateSampleReceivedAtPCRLab": "2025-09-02",
        "testResult": "102,000 copies/mL",
        "resultDate": "2025-09-03",
        "assayDate": "2025-09-03",
        "approvalDate": "2025-09-03",
        "dateResultDispatched": "2025-09-04",
        "sampleStatus": 3,
        "sampleTestable": true,
        "testedBy": "MLS. H. Musa",
        "approvedBy": "Dr. A. Shola"
      },
      {
        "patientID": [{ "idNumber": "HOSP0004456", "idTypeCode": "HOSPITALNO" }],
        "firstName": "HALIMA",
        "surName": "GARBA",
        "sex": "F",
        "dateOfBirth": "1999-11-15",
        "sampleID": "SMP0000004",
        "pcrLabSampleNumber": "PCR-ABJ-240901-004",
        "visitDate": "2025-08-31",
        "dateSampleReceivedAtPCRLab": "2025-09-02",
        "testResult": "Haemolysed – Not Tested",
        "resultDate": "2025-09-03",
        "assayDate": "2025-09-03",
        "approvalDate": "2025-09-03",
        "dateResultDispatched": "2025-09-04",
        "sampleStatus": 2,
        "sampleTestable": false,
        "reasonNotTested": 3,
        "testedBy": "MLS. R. Danladi",
        "approvedBy": "Dr. K. Moses"
      },
      {
        "patientID": [{ "idNumber": "HOSP0005567", "idTypeCode": "HOSPITALNO" }],
        "firstName": "CHINEDU",
        "surName": "OKAFOR",
        "sex": "M",
        "dateOfBirth": "1993-12-30",
        "sampleID": "SMP0000005",
        "pcrLabSampleNumber": "PCR-ABJ-240901-005",
        "visitDate": "2025-08-31",
        "dateSampleReceivedAtPCRLab": "2025-09-02",
        "testResult": "Insufficient volume – Recollect",
        "resultDate": "2025-09-03",
        "assayDate": "2025-09-03",
        "approvalDate": "2025-09-03",
        "dateResultDispatched": "2025-09-04",
        "sampleStatus": 4,
        "sampleTestable": false,
        "reasonNotTested": 4,
        "testedBy": "MLS. B. Afolabi",
        "approvedBy": "Dr. S. Idris"
      },
      {
        "patientID": [{ "idNumber": "CLI00077890", "idTypeCode": "CLIENTID" }],
        "firstName": "MARYAM",
        "surName": "LAWAL",
        "sex": "F",
        "dateOfBirth": "2003-08-22",
        "sampleID": "SMP0000006",
        "pcrLabSampleNumber": "PCR-ABJ-240901-006",
        "visitDate": "2025-08-31",
        "dateSampleReceivedAtPCRLab": "2025-09-02",
        "testResult": "Leakage on arrival – Not Testable",
        "resultDate": "2025-09-03",
        "assayDate": "2025-09-03",
        "approvalDate": "2025-09-03",
        "dateResultDispatched": "2025-09-04",
        "sampleStatus": 2,
        "sampleTestable": false,
        "reasonNotTested": 2,
        "testedBy": "MLS. T. Andrew",
        "approvedBy": "Dr. L. Ime"
      },
      {
        "patientID": [{ "idNumber": "REC00078901", "idTypeCode": "RECENCY" }],
        "firstName": "SAMUEL",
        "surName": "PETER",
        "sex": "M",
        "dateOfBirth": "1980-02-02",
        "sampleID": "SMP0000007",
        "pcrLabSampleNumber": "PCR-ABJ-240901-007",
        "visitDate": "2025-08-31",
        "dateSampleReceivedAtPCRLab": "2025-09-02",
        "testResult": "1,250 copies/mL",
        "resultDate": "2025-09-03",
        "assayDate": "2025-09-03",
        "approvalDate": "2025-09-03",
        "dateResultDispatched": "2025-09-04",
        "sampleStatus": 3,
        "sampleTestable": true,
        "testedBy": "MLS. Z. Okeke",
        "approvedBy": "Dr. T. Okon"
      },
      {
        "patientID": [{ "idNumber": "HOSP0006678", "idTypeCode": "HOSPITALNO" }],
        "firstName": "AISHA",
        "surName": "YAKUBU",
        "sex": "F",
        "dateOfBirth": "1995-01-10",
        "sampleID": "SMP0000008",
        "pcrLabSampleNumber": "PCR-ABJ-240901-008",
        "visitDate": "2025-08-31",
        "dateSampleReceivedAtPCRLab": "2025-09-02",
        "testResult": "23,450 copies/mL",
        "resultDate": "2025-09-03",
        "assayDate": "2025-09-03",
        "approvalDate": "2025-09-03",
        "dateResultDispatched": "2025-09-04",
        "sampleStatus": 3,
        "sampleTestable": true,
        "testedBy": "MLS. P. Jonah",
        "approvedBy": "Dr. A. Shola"
      },
      {
        "patientID": [{ "idNumber": "CLI00088901", "idTypeCode": "CLIENTID" }],
        "firstName": "MUSA",
        "surName": "DANLADI",
        "sex": "M",
        "dateOfBirth": "1986-06-06",
        "sampleID": "SMP0000009",
        "pcrLabSampleNumber": "PCR-KAD-240902-055",
        "visitDate": "2025-08-31",
        "dateSampleReceivedAtPCRLab": "2025-09-02",
        "testResult": "5,600 copies/mL",
        "resultDate": "2025-09-03",
        "assayDate": "2025-09-03",
        "approvalDate": "2025-09-03",
        "dateResultDispatched": "2025-09-04",
        "sampleStatus": 3,
        "sampleTestable": true,
        "transferStatus": 2,
        "sendingPCRLabID": "LIMS170004",
        "sendingPCRLabName": "Kaduna PCR Reference Lab",
        "dateTransferredOut": "2025-09-02",
        "testedBy": "MLS. U. Bala",
        "approvedBy": "Dr. O. Rabiu"
      },
      {
        "patientID": [{ "idNumber": "HOSP0007789", "idTypeCode": "HOSPITALNO" }],
        "firstName": "RUKAYYAT",
        "surName": "AHMAD",
        "sex": "F",
        "dateOfBirth": "1996-04-25",
        "sampleID": "SMP0000010",
        "pcrLabSampleNumber": "PCR-KAD-240902-056",
        "visitDate": "2025-08-31",
        "dateSampleReceivedAtPCRLab": "2025-09-02",
        "testResult": "<20 copies/mL (Target Not Detected)",
        "resultDate": "2025-09-03",
        "assayDate": "2025-09-03",
        "approvalDate": "2025-09-03",
        "dateResultDispatched": "2025-09-04",
        "sampleStatus": 3,
        "sampleTestable": true,
        "transferStatus": 3,
        "sendingPCRLabID": "LIMS170004",
        "sendingPCRLabName": "Kaduna PCR Reference Lab",
        "dateTransferredOut": "2025-09-02",
        "testedBy": "MLS. U. Bala",
        "approvedBy": "Dr. O. Rabiu"
      }
    ]
  }
  